{
  "schema_version": "1.0",
  "lab": {
    "number": 9,
    "slug": "dynamic-workflows",
    "coach": "coach-09-dynamic-workflows"
  },
  "learner": "dryrun",
  "mode": "dry-run",
  "run": {
    "started_at": "2026-10-22T10:15:00Z",
    "run_index": 2,
    "transcript": "labs/09-dynamic-workflows/coaching/dryrun/off-track.md",
    "timing_method": "markers",
    "timing_tolerance_seconds": 5,
    "graded_by": "inline"
  },
  "timing": [
    {
      "segment": "framing",
      "kind": "framing",
      "label": "60-second framing",
      "target_seconds": 60,
      "actual_seconds": 100,
      "delta_seconds": 40,
      "verdict": "over"
    },
    {
      "segment": "checkpoint-20",
      "kind": "checkpoint",
      "label": "Think-aloud checkpoint (T+20)",
      "target_seconds": 45,
      "actual_seconds": 25,
      "delta_seconds": -20,
      "verdict": "under"
    },
    {
      "segment": "checkpoint-120",
      "kind": "checkpoint",
      "label": "Think-aloud checkpoint (T+120)",
      "target_seconds": 45,
      "actual_seconds": 65,
      "delta_seconds": 20,
      "verdict": "over"
    },
    {
      "segment": "update",
      "kind": "update",
      "label": "Three-minute auditor update",
      "target_seconds": 180,
      "actual_seconds": 60,
      "delta_seconds": -120,
      "verdict": "under",
      "interruptions": 1
    },
    {
      "segment": "objection-1",
      "kind": "objection",
      "label": "Objection 1 (technical)",
      "question": "How do I know an agent didn't skip endpoints and call it clean?",
      "target_seconds": 90,
      "actual_seconds": 35,
      "delta_seconds": -55,
      "verdict": "under"
    },
    {
      "segment": "objection-2",
      "kind": "objection",
      "label": "Objection 2 (commercial)",
      "question": "Why pay for a fan-out of agents when one engineer could read 22 endpoints in an afternoon?",
      "target_seconds": 90,
      "actual_seconds": 30,
      "delta_seconds": -60,
      "verdict": "under"
    }
  ],
  "structure": {
    "problem": {
      "status": "missing",
      "quote": ""
    },
    "approach": {
      "status": "weak",
      "quote": "dynamic workflows are basically a Python script that starts other Devin sessions"
    },
    "evidence": {
      "status": "missing",
      "quote": ""
    },
    "next_step": {
      "status": "missing",
      "quote": ""
    },
    "order_held": false
  },
  "fillers_and_pauses": {
    "spoken_minutes": 5.2,
    "filler_count": 10,
    "filler_rate_per_minute": 1.92,
    "fillers": [
      {
        "word": "actually",
        "count": 2
      },
      {
        "word": "basically",
        "count": 2
      },
      {
        "word": "you know",
        "count": 2
      },
      {
        "word": "like",
        "count": 1
      },
      {
        "word": "um",
        "count": 3
      }
    ],
    "tag_questions": 2,
    "tag_question_examples": [
      "Basically I think it's a really powerful feature for this kind of thing, no?",
      "Actually I trust them, right?"
    ],
    "long_pauses": [
      {
        "at": "02:40",
        "seconds": 15,
        "segment": "checkpoint-120"
      },
      {
        "at": "05:30",
        "seconds": 14,
        "segment": "objection-1"
      }
    ]
  },
  "must_mention": [
    {
      "id": "mm1",
      "point": "Every endpoint covered: the count comes from the code (22 in 7 route files) and a small slice ran first",
      "weight": 8,
      "mentioned": false,
      "evidence_quote": "",
      "belonged_in": "framing"
    },
    {
      "id": "mm2",
      "point": "The confirmed leak: the single-order read filters on id alone, so staff of one brand can read the other brand's order",
      "weight": 6,
      "mentioned": true,
      "evidence_quote": "only filters on the id, so another brand's staff can see it",
      "belonged_in": "update"
    },
    {
      "id": "mm3",
      "point": "A failed or invalid agent was caught in code with a bounded retry, and resuming the same run ID replayed finished agents",
      "weight": 6,
      "mentioned": false,
      "evidence_quote": "",
      "belonged_in": "checkpoint-120"
    },
    {
      "id": "mm4",
      "point": "The fix lives on a throwaway branch named by the script, a separate agent verified it, and main keeps the defect",
      "weight": 5,
      "mentioned": false,
      "evidence_quote": "",
      "belonged_in": "update"
    },
    {
      "id": "mm5",
      "point": "Cost quoted per agent from the run (roughly 0.7–1.0 ACU each, about 3.5 for the slice) with a projection for the full run",
      "weight": 5,
      "mentioned": false,
      "evidence_quote": "",
      "belonged_in": "objection-2"
    }
  ],
  "clarity": {
    "caveat": "transcript-based, approximate",
    "misrecognised_words": [],
    "repeated_words": [
      "basically (×2)",
      "um (×3)"
    ],
    "clarification_requests": [],
    "article_plural_slips": [
      "\"I fixed it directly so it's done\" — a fix on main breaks the freeze; say where it lives"
    ],
    "sentences_to_rerecord": [
      "Um, so dynamic workflows are basically a Python script…",
      "I fixed it directly so it's done."
    ]
  },
  "scores": {
    "accuracy": {
      "score": 7,
      "max": 30,
      "anchor": "Only the leak itself was named; no coverage, failure handling, verification or cost (anchors: 27–30 every point with a number; 15–20 three of five; under 10 one point)."
    },
    "structure": {
      "score": 6,
      "max": 25,
      "anchor": "Feature tour instead of a verdict; no evidence or next step (anchors: 22–25 all parts in order; 13–17 parts present but weak; under 8 problem only)."
    },
    "customer_relevance": {
      "score": 4,
      "max": 20,
      "anchor": "No endpoint count, ignored the freeze, no cost (anchors: 16–20 auditor's numbers and constraints used; 10–13 some numbers; under 6 feature talk)."
    },
    "brevity_and_fluency": {
      "score": 3,
      "max": 15,
      "anchor": "Five of six segments off target; ten fillers, two tag questions, two long pauses (anchors: 11–15 segments on target, under 1 filler/min; 6–8 two or more segments off; under 4 most segments off)."
    },
    "recovery": {
      "score": 2,
      "max": 10,
      "anchor": "Neither objection acknowledged or bounded; the commercial answer had no numbers (anchors: 7–10 acknowledge → boundary → evidence → offer held with numbers; 4–6 partial; under 3 no pattern)."
    },
    "total": 22
  },
  "stems": [
    "\"You get…\" — open with what the auditor receives.",
    "\"The run noticed because…\" — read the log before saying nothing went wrong.",
    "\"Per agent, the run cost…\" — bring numbers to every cost question."
  ],
  "previous_run_comparison": "Second grading of the same transcript; scores within 1 point of run 1."
}
