{
  "schema_version": "1.0",
  "lab": {
    "number": 14,
    "slug": "outposts",
    "coach": "coach-14-outposts"
  },
  "learner": "dryrun",
  "mode": "dry-run",
  "run": {
    "started_at": "2026-10-22T11:10:00Z",
    "run_index": 1,
    "transcript": "labs/14-outposts/coaching/dryrun/off-track.md",
    "timing_method": "markers",
    "timing_tolerance_seconds": 5,
    "graded_by": "inline"
  },
  "timing": [
    {
      "segment": "framing",
      "kind": "framing",
      "label": "60-second framing for the CISO",
      "target_seconds": 60,
      "actual_seconds": 95,
      "delta_seconds": 35,
      "verdict": "over"
    },
    {
      "segment": "checkpoint-15",
      "kind": "checkpoint",
      "label": "Think-aloud checkpoint (T+15)",
      "target_seconds": 45,
      "actual_seconds": 30,
      "delta_seconds": -15,
      "verdict": "under"
    },
    {
      "segment": "checkpoint-60",
      "kind": "checkpoint",
      "label": "Think-aloud checkpoint (T+60)",
      "target_seconds": 45,
      "actual_seconds": 70,
      "delta_seconds": 25,
      "verdict": "over"
    },
    {
      "segment": "update",
      "kind": "update",
      "label": "Three-minute update to the CISO",
      "target_seconds": 180,
      "actual_seconds": 120,
      "delta_seconds": -60,
      "verdict": "under"
    },
    {
      "segment": "objection-1",
      "kind": "objection",
      "label": "Objection 1 (data boundary)",
      "target_seconds": 90,
      "actual_seconds": 40,
      "delta_seconds": -50,
      "verdict": "under",
      "question": "The control plane still sees our code, so what did we actually gain?"
    },
    {
      "segment": "objection-2",
      "kind": "objection",
      "label": "Objection 2 (availability)",
      "target_seconds": 90,
      "actual_seconds": 55,
      "delta_seconds": -35,
      "verdict": "under",
      "question": "What happens when the worker is down at 2 a.m.?"
    },
    {
      "segment": "objection-3",
      "kind": "objection",
      "label": "Objection 3 (ownership)",
      "target_seconds": 90,
      "actual_seconds": 35,
      "delta_seconds": -55,
      "verdict": "under",
      "question": "Who patches the worker image?"
    }
  ],
  "structure": {
    "problem": {
      "status": "weak",
      "quote": "Outposts is basically like a private Devin"
    },
    "approach": {
      "status": "weak",
      "quote": "I put the token in the Dockerfile"
    },
    "evidence": {
      "status": "missing",
      "quote": "mostly fine"
    },
    "next_step": {
      "status": "missing",
      "quote": "it should be fine"
    },
    "order_held": false
  },
  "fillers_and_pauses": {
    "spoken_minutes": 7.4,
    "filler_count": 12,
    "filler_rate_per_minute": 1.62,
    "fillers": [
      {
        "word": "actually",
        "count": 4
      },
      {
        "word": "basically",
        "count": 2
      },
      {
        "word": "so yeah",
        "count": 3
      },
      {
        "word": "you know",
        "count": 1
      },
      {
        "word": "like",
        "count": 1
      },
      {
        "word": "um",
        "count": 1
      }
    ],
    "tag_questions": 1,
    "tag_question_examples": [
      "It is all private now, no?"
    ],
    "long_pauses": [
      {
        "at": "01:57",
        "seconds": 14,
        "segment": "checkpoint-15"
      },
      {
        "at": "04:31",
        "seconds": 12,
        "segment": "update"
      }
    ]
  },
  "must_mention": [
    {
      "id": "mm1",
      "point": "Commands, file edits and repo access run on Harbourline's worker in the VPC while inference and planning stay in Devin Cloud",
      "weight": 6,
      "mentioned": true,
      "belonged_in": "framing",
      "evidence_quote": "the worker runs in our VPC, so the code runs there and Devin Cloud only does the thinking"
    },
    {
      "id": "mm2",
      "point": "Worker started with devin worker start plus the outpost name and its token, the token shown once and kept in the secret manager",
      "weight": 5,
      "mentioned": false,
      "belonged_in": "checkpoint-15"
    },
    {
      "id": "mm3",
      "point": "One session per worker so two containers serve two sessions and the third waits under a banner rather than failing",
      "weight": 5,
      "mentioned": false,
      "belonged_in": "checkpoint-60"
    },
    {
      "id": "mm4",
      "point": "Engineers reach the outpost through the organization default platform and the Slack bang command",
      "weight": 4,
      "mentioned": true,
      "belonged_in": "update",
      "evidence_quote": "People can use the default platform setting or Slack."
    },
    {
      "id": "mm5",
      "point": "Image bakes in the repo with git, ffmpeg and Chrome via DEVIN_CHROME_PATH and grants no passwordless sudo",
      "weight": 4,
      "mentioned": false,
      "belonged_in": "update"
    },
    {
      "id": "mm6",
      "point": "Platform engineering rebuilds the image on a schedule and rolls one worker at a time",
      "weight": 3,
      "mentioned": false,
      "belonged_in": "objection-3"
    },
    {
      "id": "mm7",
      "point": "Which steps ran live and which only ran on the offline queue model",
      "weight": 3,
      "mentioned": false,
      "belonged_in": "update"
    }
  ],
  "clarity": {
    "misrecognised_words": [],
    "repeated_words": [
      "so yeah (×3)"
    ],
    "clarification_requests": [],
    "article_plural_slips": [],
    "sentences_to_rerecord": [
      "It is all private now, no? Nothing leaves the VPC.",
      "No, it does not see our code any more."
    ],
    "caveat": "transcript-based, approximate"
  },
  "scores": {
    "accuracy": {
      "score": 9,
      "max": 30,
      "anchor": "Only the boundary and the routing stated, and the boundary is then contradicted (anchor: 6–10 = two of seven points, one wrong claim)."
    },
    "structure": {
      "score": 8,
      "max": 25,
      "anchor": "No skeleton in the update; no evidence and no next action anywhere (anchor: 6–9 = parts missing)."
    },
    "customer_relevance": {
      "score": 6,
      "max": 20,
      "anchor": "Claims nothing leaves the VPC, the opposite of what the CISO needs to hear (anchor: 5–8 = misleading to the customer)."
    },
    "brevity_and_fluency": {
      "score": 3,
      "max": 15,
      "anchor": "Every segment off target; twelve fillers in 8.6 minutes, one tag question, two long pauses (anchor: 0–4 = far off target, frequent fillers)."
    },
    "recovery": {
      "score": 2,
      "max": 10,
      "anchor": "All three objections dismissed or wrong; no acknowledge or offer (anchor: 0–2 = pattern not used)."
    },
    "total": 28
  },
  "stems": [
    "\"Execution moves; inference does not.\" — never say nothing leaves the VPC.",
    "\"The token is shown once; it lives in the secret manager, never in the image.\"",
    "\"Two workers, two sessions; the third waits, it does not fail.\" — read the queue replay before you report it."
  ],
  "previous_run_comparison": "First recorded run for dryrun on lab 14; no previous run to compare with."
}
