{
  "schema_version": "1.0",
  "lab": {
    "number": 11,
    "slug": "acu-analytics",
    "coach": "coach-11-acu-analytics"
  },
  "learner": "dryrun",
  "mode": "dry-run",
  "run": {
    "started_at": "2026-10-22T11:20:00Z",
    "run_index": 2,
    "transcript": "labs/11-acu-analytics/coaching/dryrun/mediocre.md",
    "timing_method": "markers",
    "timing_tolerance_seconds": 5,
    "graded_by": "inline"
  },
  "timing": [
    {
      "segment": "framing",
      "kind": "framing",
      "label": "60-second framing",
      "target_seconds": 60,
      "actual_seconds": 70,
      "delta_seconds": 10,
      "verdict": "over"
    },
    {
      "segment": "checkpoint-10",
      "kind": "checkpoint",
      "label": "Think-aloud checkpoint (T+10)",
      "target_seconds": 45,
      "actual_seconds": 34,
      "delta_seconds": -11,
      "verdict": "under"
    },
    {
      "segment": "checkpoint-40",
      "kind": "checkpoint",
      "label": "Think-aloud checkpoint (T+40)",
      "target_seconds": 45,
      "actual_seconds": 42,
      "delta_seconds": -3,
      "verdict": "on"
    },
    {
      "segment": "update",
      "kind": "update",
      "label": "Update to the finance controller",
      "target_seconds": 180,
      "actual_seconds": 141,
      "delta_seconds": -39,
      "verdict": "under"
    },
    {
      "segment": "objection-1",
      "kind": "objection",
      "label": "Objection 1 (commercial)",
      "question": "Trailhead will be blocked mid-sale.",
      "target_seconds": 90,
      "actual_seconds": 46,
      "delta_seconds": -44,
      "verdict": "under"
    },
    {
      "segment": "objection-2",
      "kind": "objection",
      "label": "Objection 2 (technical)",
      "question": "Why do the two dashboards show different totals?",
      "target_seconds": 90,
      "actual_seconds": 68,
      "delta_seconds": -22,
      "verdict": "under"
    }
  ],
  "structure": {
    "problem": {
      "status": "weak",
      "quote": "So Harbourline has three organizations, and a contract that renews monthly, and there are tiers"
    },
    "approach": {
      "status": "present",
      "quote": "there are two limits, the organization one and the personal one"
    },
    "evidence": {
      "status": "weak",
      "quote": "Trailhead used 3,000, Lumen 4,100, Platform 1,770, the enterprise 8,870, and the sale adds 900"
    },
    "next_step": {
      "status": "present",
      "quote": "Ask: can you approve the new Trailhead limit?"
    },
    "order_held": false
  },
  "fillers_and_pauses": {
    "spoken_minutes": 6.7,
    "filler_count": 5,
    "filler_rate_per_minute": 0.75,
    "fillers": [
      {
        "word": "actually",
        "count": 2
      },
      {
        "word": "basically",
        "count": 2
      },
      {
        "word": "you know",
        "count": 1
      }
    ],
    "tag_questions": 1,
    "tag_question_examples": [
      "The empty report means no billing cycle for those dates, right?"
    ],
    "long_pauses": [
      {
        "at": "02:10",
        "seconds": 11,
        "segment": "checkpoint-40"
      }
    ]
  },
  "must_mention": [
    {
      "id": "mm1",
      "point": "Organization limit and per-user tier are enforced independently; either one blocks, and raising one never lifts the other",
      "weight": 6,
      "mentioned": true,
      "evidence_quote": "there are two limits, the organization one and the personal one, and they are enforced independently, so either one can block you",
      "belonged_in": "framing"
    },
    {
      "id": "mm2",
      "point": "The Trailhead lead is at 180 of 400 on her tier but Trailhead is at 3,000 of 3,000, so only an enterprise admin raising the org limit helps",
      "weight": 5,
      "mentioned": true,
      "evidence_quote": "Trailhead is at 3,000 of 3,000, so she is blocked by the organization and an admin has to raise the org limit",
      "belonged_in": "checkpoint-10"
    },
    {
      "id": "mm3",
      "point": "The per-user meter counts cloud plus local usage and leaves Devin Review out; the org limit includes Review",
      "weight": 4,
      "mentioned": true,
      "evidence_quote": "at 410, which is cloud plus local, and Review is not counted for him",
      "belonged_in": "checkpoint-40"
    },
    {
      "id": "mm4",
      "point": "Limits reset on the contract day, the 23rd, after the 18–20 Nov sale, and temporary overrides expire then",
      "weight": 4,
      "mentioned": false,
      "evidence_quote": "",
      "belonged_in": "update"
    },
    {
      "id": "mm5",
      "point": "Newest vs Legacy is the gear-icon Version setting; Cloud-only metrics exclude local usage; the empty state means no billing cycle in range",
      "weight": 4,
      "mentioned": true,
      "evidence_quote": "a Cloud-only number from the Newest version in the gear menu, so it has no local usage. The empty report means no billing cycle for those dates",
      "belonged_in": "checkpoint-40"
    },
    {
      "id": "mm6",
      "point": "A tier applies to each member, not a pooled team budget; a team cap is an organization-level limit",
      "weight": 4,
      "mentioned": true,
      "evidence_quote": "a tier is per member, not a team budget, so the team cap you want is the organization limit",
      "belonged_in": "update"
    },
    {
      "id": "mm7",
      "point": "The finance update carried exactly three ACU figures, each with the view it came from",
      "weight": 3,
      "mentioned": false,
      "evidence_quote": "",
      "belonged_in": "update"
    }
  ],
  "clarity": {
    "misrecognised_words": [],
    "repeated_words": [
      "\"and\" chained five times in the framing"
    ],
    "clarification_requests": [],
    "article_plural_slips": [
      "\"raise the org limit\" — say \"the organization limit\" to finance"
    ],
    "sentences_to_rerecord": [
      "So Harbourline has three organizations, and a contract that renews monthly, and there are tiers, and IdP groups…"
    ],
    "caveat": "transcript-based, approximate"
  },
  "scores": {
    "accuracy": {
      "score": 21,
      "max": 30,
      "anchor": "Five of seven points; the reset day after the sale (mm4) and the three sourced figures (mm7) missing (anchor: 16–21 = most points, two missing)."
    },
    "structure": {
      "score": 15,
      "max": 25,
      "anchor": "Backstory before the outcome in the framing; the update had no Risk heading (anchor: 13–17 = order partly held)."
    },
    "customer_relevance": {
      "score": 11,
      "max": 20,
      "anchor": "Numbers present but five figures in one sentence and none with its view (anchor: 12–15 = numbers present, buried)."
    },
    "brevity_and_fluency": {
      "score": 8,
      "max": 15,
      "anchor": "Framing 10 s over, checkpoint-10, the update and both objections under; five fillers, one tag question, an 11 s pause (anchor: 7–9 = several segments off)."
    },
    "recovery": {
      "score": 4,
      "max": 10,
      "anchor": "Objection 1 opened with \"No\"; objection 2 acknowledged but deferred the evidence (anchor: 5–7 = pattern held once, partly)."
    },
    "total": 59
  },
  "stems": [
    "\"She was under her own cap; the organization was not.\" — open the framing with the outcome, not the org chart.",
    "\"The reset is on the 23rd; the sale ends on the 20th.\" — your update had no risk sentence; this is it.",
    "\"Three numbers: … from …, … from …, … from …\" — one figure per sentence, each with its view."
  ],
  "previous_run_comparison": "Second grading of the same transcript: total 59 against 61 on run 1."
}
