{
  "schema_version": "1.0",
  "lab": {
    "number": 6,
    "slug": "review-remediation",
    "coach": "coach-06-review-remediation"
  },
  "learner": "dryrun",
  "mode": "dry-run",
  "run": {
    "started_at": "2026-10-22T12:25:00Z",
    "run_index": 1,
    "transcript": "labs/06-review-remediation/coaching/dryrun/mediocre.md",
    "timing_method": "markers",
    "timing_tolerance_seconds": 5,
    "graded_by": "inline"
  },
  "timing": [
    {
      "segment": "framing",
      "kind": "framing",
      "label": "60-second framing",
      "target_seconds": 60,
      "actual_seconds": 74,
      "delta_seconds": 14,
      "verdict": "over"
    },
    {
      "segment": "checkpoint-10",
      "kind": "checkpoint",
      "label": "Think-aloud checkpoint (T+10)",
      "target_seconds": 45,
      "actual_seconds": 50,
      "delta_seconds": 5,
      "verdict": "on"
    },
    {
      "segment": "checkpoint-50",
      "kind": "checkpoint",
      "label": "Think-aloud checkpoint (T+50)",
      "target_seconds": 45,
      "actual_seconds": 46,
      "delta_seconds": 1,
      "verdict": "on"
    },
    {
      "segment": "update",
      "kind": "update",
      "label": "Update to the tech lead",
      "target_seconds": 180,
      "actual_seconds": 210,
      "delta_seconds": 30,
      "verdict": "over",
      "interruptions": 1
    },
    {
      "segment": "objection-1",
      "kind": "objection",
      "label": "Objection 1 (technical)",
      "question": "That per-line query thing is a flag, not a bug. Carts are small. Why are you blocking my PR on it?",
      "target_seconds": 90,
      "actual_seconds": 56,
      "delta_seconds": -34,
      "verdict": "under"
    },
    {
      "segment": "objection-2",
      "kind": "objection",
      "label": "Objection 2 (commercial)",
      "question": "Every review round costs us a day before Black Friday. Why not ship and fix forward?",
      "target_seconds": 90,
      "actual_seconds": 70,
      "delta_seconds": -20,
      "verdict": "under"
    }
  ],
  "structure": {
    "problem": {
      "status": "weak",
      "quote": "because it touches totals, and because Black Friday is coming, and because of the tax, I think we need a review"
    },
    "approach": {
      "status": "weak",
      "quote": "I will use Devin Review on it, basically."
    },
    "evidence": {
      "status": "weak",
      "quote": "It is right now, I think, 39.80 or so."
    },
    "next_step": {
      "status": "missing",
      "quote": "So yeah, that is the update."
    },
    "order_held": false
  },
  "fillers_and_pauses": {
    "spoken_minutes": 8.4,
    "filler_count": 6,
    "filler_rate_per_minute": 0.71,
    "fillers": [
      {
        "word": "actually",
        "count": 2
      },
      {
        "word": "basically",
        "count": 2
      },
      {
        "word": "so yeah",
        "count": 1
      },
      {
        "word": "you know",
        "count": 1
      }
    ],
    "tag_questions": 1,
    "tag_question_examples": [
      "The rounding one is the big one for finance, right?"
    ],
    "long_pauses": [
      {
        "at": "02:20",
        "seconds": 12,
        "segment": "checkpoint-10"
      }
    ]
  },
  "must_mention": [
    {
      "id": "mm1",
      "point": "Effort level chosen on purpose: the highest for a change to totals and tax, the default for low-risk PRs",
      "weight": 5,
      "mentioned": false,
      "belonged_in": "framing"
    },
    {
      "id": "mm2",
      "point": "The PR truncates per-line totals: two €19.90 socks come to 39.79 instead of 39.80",
      "weight": 5,
      "mentioned": true,
      "evidence_quote": "The PR truncates per-line totals: two €19.90 socks come to 39.79 instead of 39.80. I will use Devin Review on it, basically.",
      "belonged_in": "framing"
    },
    {
      "id": "mm3",
      "point": "Security is checked on every review: a self-declared staff role lets a shopper set a price",
      "weight": 5,
      "mentioned": true,
      "evidence_quote": "Security is checked on every review, and I think a self-declared staff role lets a shopper set a price. I'll leave the settings as they are.",
      "belonged_in": "framing"
    },
    {
      "id": "mm4",
      "point": "A regression test that failed on the PR and passes on the fix is the evidence, not the green suite",
      "weight": 4,
      "mentioned": true,
      "evidence_quote": "So we fixed the rounding and the override on a branch. A regression test that failed on the PR and passes on the fix is the evidence, not the green suite.",
      "belonged_in": "update"
    },
    {
      "id": "mm5",
      "point": "One finding quoted into the review chat, and the answer checked against a test",
      "weight": 3,
      "mentioned": true,
      "evidence_quote": "I quoted one finding into the review chat and checked the answer against a test, actually. Then the re-review after the fix resolved the findings; an unchanged diff is skipped, not re-reviewed.",
      "belonged_in": "update"
    },
    {
      "id": "mm6",
      "point": "Re-review after the fix resolved the findings; an unchanged diff is skipped, not re-reviewed",
      "weight": 3,
      "mentioned": true,
      "evidence_quote": "I quoted one finding into the review chat and checked the answer against a test, actually. Then the re-review after the fix resolved the findings; an unchanged diff is skipped, not re-reviewed.",
      "belonged_in": "update"
    },
    {
      "id": "mm7",
      "point": "The review rule targeted only money.ts; replaced with one covering every money path",
      "weight": 3,
      "mentioned": false,
      "belonged_in": "update"
    },
    {
      "id": "mm8",
      "point": "Disputed flag settled with evidence on the thread, and nothing merged into main",
      "weight": 2,
      "mentioned": true,
      "evidence_quote": "The disputed flag I settled with evidence on the thread, and nothing merged into main. So yeah, that is the update.",
      "belonged_in": "update"
    }
  ],
  "clarity": {
    "caveat": "transcript-based, approximate",
    "misrecognised_words": [],
    "repeated_words": [
      "because (×3 in the opening sentence)"
    ],
    "clarification_requests": [],
    "article_plural_slips": [
      "\"There are a few of them\" — give the count: \"One security finding, three bugs.\""
    ],
    "sentences_to_rerecord": [
      "So, basically, because it touches totals…"
    ]
  },
  "scores": {
    "accuracy": {
      "score": 22,
      "max": 30,
      "anchor": "Six of eight points stated; the effort-level choice and the review rule were never mentioned (anchor: 18–22 = most points, two missing)."
    },
    "structure": {
      "score": 14,
      "max": 25,
      "anchor": "Framing front-loaded three \"because\" clauses; the update had no risk and no ask (anchor: 13–16 = parts findable, order broken)."
    },
    "customer_relevance": {
      "score": 10,
      "max": 20,
      "anchor": "\"39.80 or so\" when asked for the subtotal; no before/after amount (anchor: 9–12 = one hedged number)."
    },
    "brevity_and_fluency": {
      "score": 7,
      "max": 15,
      "anchor": "Framing 14 s and update 30 s over; six fillers, one tag question, one 12-second pause (anchor: 6–8)."
    },
    "recovery": {
      "score": 4,
      "max": 10,
      "anchor": "Neither objection acknowledged; no evidence and no offer (anchor: 3–5)."
    },
    "total": 57
  },
  "stems": [
    "\"Not safe to ship, here is why\" — the decision before the reasons.",
    "\"39.79 on the PR, 39.80 on the fix\" — both numbers, no \"or so\".",
    "\"I chose this effort level because…\" — say the choice and the reason."
  ],
  "previous_run_comparison": "First recorded run for dryrun on lab 06; no previous run to compare with."
}
